{
  "$schema": "https://json-schema.org/draft/2020-12/schema",
  "$id": "candidates.schema.json",
  "title": "収集候補 (candidates/YYYY-MM-DD.json)",
  "description": "collect 層(REQUIREMENTS.md 4.1)が正規化して蓄積する候補。verify 層が verify フィールドを更新する。記事の sources に現れる URL はいずれかの candidates に存在しなければならない(出典 lint)。",
  "type": "array",
  "items": {
    "type": "object",
    "required": [
      "id",
      "title",
      "brand",
      "source_type",
      "url",
      "found_at",
      "dedup_key",
      "verify"
    ],
    "additionalProperties": false,
    "properties": {
      "id": {
        "type": "string",
        "description": "候補の一意 ID"
      },
      "title": {
        "type": "string"
      },
      "brand": {
        "enum": [
          "general",
          "765",
          "cg",
          "million",
          "shiny",
          "sidem",
          "gaku",
          "dsva",
          "joint",
          "other"
        ]
      },
      "source_type": {
        "enum": [
          "公式",
          "準公式",
          "当事者",
          "演者",
          "報道",
          "ファン",
          "二次情報",
          "もちより",
          "未確認"
        ]
      },
      "url": {
        "type": "string",
        "pattern": "^https?://"
      },
      "found_at": {
        "type": "string",
        "description": "発見日時(ISO 8601, JST)"
      },
      "event_date": {
        "type": "string",
        "pattern": "^\\d{4}-\\d{2}-\\d{2}$"
      },
      "published_date": {
        "type": "string",
        "pattern": "^\\d{4}-\\d{2}-\\d{2}$",
        "description": "情報の初出日(ページ掲載日・ポスト投稿日)。鮮度判定(verify)と新規性表現の裏取りに使う"
      },
      "dedup_key": {
        "type": "string",
        "description": "重複排除キー"
      },
      "link_from": {
        "type": "string",
        "pattern": "^https?://",
        "description": "リンク元: url がリンクとして載っていた投稿・ページの URL(収集がリンクを辿って url に来たとき)。出典の種別の判定(classify_sources)が、リンク元の種別を引き継ぐかを合議に確かめさせる材料"
      },
      "src_dedup_key": {
        "type": "string",
        "minLength": 1,
        "description": "続報予約に添えた素材(schema/scheduled の companion_of の行)を候補へ戻したときの、その素材の元の話題(元候補の dedup_key)。dedup_key は添え先の予約のもの。執筆には予約と違うときだけ other_topic として見せる"
      },
      "facts": {
        "type": "array",
        "items": {
          "type": "string"
        },
        "description": "一次ソースから抽出した事実の列挙。記事はここに無い事実を書かない"
      },
      "periods": {
        "type": "array",
        "items": {
          "type": "string"
        },
        "description": "期間ラベル規程(REQUIREMENTS.md 4.6 相当)向けの期間抽出。「何の期間か」を出典の語で明示した文字列(例: 受付期間/当落発表/入金期間)。facts の補助情報で、収集層が期間の種別混同を防ぐために付与する"
      },
      "origin": {
        "enum": [
          "watch",
          "explore"
        ],
        "description": "watch=定点観測(sources.yml) / explore=探索(Web検索・Grok)。ランキングのトレンド分は explore 由来の言及を数える"
      },
      "via": {
        "enum": [
          "watch",
          "explore",
          "claude",
          "grok"
        ],
        "description": "収集経路(定点観測 / 探索 / Grok X調査)。claude は探索役が Claude だった頃の旧値で、過去の候補ファイルのために残している"
      },
      "deadline": {
        "type": "string",
        "pattern": "^\\d{4}-\\d{2}-\\d{2}$",
        "description": "締切・終了日(続報キューのトリガー予約に使う)"
      },
      "verify": {
        "enum": [
          "confirmed",
          "unconfirmed",
          "failed"
        ],
        "description": "verify 層の照合結果(REQUIREMENTS 4.2)。confirmed = URL が生きている + 種別が公式/準公式/当事者/報道 + facts の日付・金額が出典本文にある。照合できるのは日付と金額だけで、文意の一致は見ていない。探索由来は登録時 unconfirmed"
      },
      "verify_note": {
        "type": "string",
        "description": "verify 結果の補足(failed の理由など。人間とパイプラインの診断用)"
      },
      "render_error": {
        "type": "string",
        "description": "verify が出典をヘッドレスブラウザで描画し直そうとして失敗した原因(終了コードと stderr の要点)。素の HTML の本文で照合を続けたことを示す。診断用"
      },
      "archived_at": {
        "type": "string",
        "description": "収集が出典ページを読んだ時点の原本(scripts/page_archive.py の置き場。url で引く)の取得時刻(ISO 8601, JST)。fetch_page.py は読み直せないときにこの原本を返す"
      },
      "unbacked_facts": {
        "type": "array",
        "items": {
          "type": "string"
        },
        "description": "facts の日付・金額のうち、出典ページの本文で確認できなかったもの。捏造の証拠ではない(掲載日や画像内の価格が拾えないことがある)が、執筆と校閲はこの値を断定して書かないこと"
      },
      "carried": {
        "type": "object",
        "required": [
          "from",
          "count",
          "why"
        ],
        "additionalProperties": false,
        "properties": {
          "from": {
            "type": "string",
            "pattern": "^\\d{4}-\\d{2}-\\d{2}$",
            "description": "記事にならなかった号の日付"
          },
          "count": {
            "type": "integer",
            "minimum": 1,
            "description": "この素材を次の号の選定に戻した回数"
          },
          "why": {
            "type": "string",
            "description": "その号で記事にならなかった理由(工程と理由の要点)"
          }
        },
        "description": "前の号の計画に入ったのに紙面に載らなかった記事の素材を、組版がこの号の選定に戻した印(compose の carry_dropped_candidates が付ける)"
      },
      "quotes": {
        "type": "array",
        "items": {
          "type": "string"
        },
        "description": "収集役が出典ページから写した1文(200字まで)。verify が本文と照らし、無ければ URL の取り違えとして failed にする"
      }
    }
  }
}
