[
  {
    "id": "202609280733-explore-0",
    "title": "765PRO ALLSTARS LIVE NEVER END IDOL Blu-ray受注締切間近",
    "brand": "765",
    "source_type": "公式",
    "url": "https://idolmaster-official.jp/news/01_20013.html",
    "found_at": "2026-09-28T07:33:03+09:00",
    "dedup_key": "765-never-end-idol-bluray-order-2026",
    "facts": [
      "2025年8月2日・3日にKアリーナ横浜で開催された「THE IDOLM@STER 765PRO ALLSTARS LIVE ～NEVER END IDOL!!!!!!!!!!!!!～」のBlu-rayが受注受付中。",
      "アソビストアではアソビストア特装版を2026年9月27日(日)まで予約受付。",
      "アイドルマスターシリーズ20年間の歴史の節目を飾る、765PRO ALLSTARS＋全員集合の集大成公演。",
      "ライブ本編映像に加え、メイキング映像を収録。",
      "アソビストア購入店舗特典はA4クリアファイル。素材はPP、サイズは約W220×H310mm、生産国は日本。",
      "特装版はBOXとフォトブック付き。",
      "収録予定内容はディスク4枚組で、Disc1がDAY1本編、Disc2がDAY1アンコール＋メイキング、Disc3がDAY2本編、Disc4がDAY2アンコール＋メイキング。",
      "ダイジェスト映像を期間限定で公開中。",
      "販売終了後、ASOBI STOREまたはそれ以外の店舗などで再販を行う場合がある。",
      "生産予定数を超過した場合、注文の途中終了や発売日の変更を行う場合がある。",
      "生産の都合により商品のお届け予定日が異なる場合がある。",
      "他のアイテムと合わせて注文した場合、全アイテムが揃ってから発送される。",
      "エンゲージメント: 高",
      "2025年8月2日、3日にKアリーナ横浜で開催された「THE IDOLM@STER 765PRO ALLSTARS LIVE ～NEVER END IDOL!!!!!!!!!!!!!～」のBlu-rayが受注受付中。",
      "アソビストアではアソビストア特装版の予約を2026年9月27日(日)まで受け付けている。",
      "本公演はアイドルマスターシリーズ20年間の歴史の節目を飾る、765PRO ALLSTARS＋全員集合の集大成公演。",
      "Blu-rayにはライブ本編映像とメイキング映像を収録。",
      "アソビストア特装版には両日の本編映像、フォトブック、豪華BOXが付属する。",
      "アソビストア購入店舗特典はA4クリアファイルで、素材はPP、サイズは約W220×H310mm、生産国は日本。",
      "収録内容はBOX＆フォトブック、ディスク4枚組で、Disc1がDAY1本編、Disc2がDAY1アンコール＋メイキング、Disc3がDAY2本編、Disc4がDAY2アンコール＋メイキング。",
      "ライブのダイジェスト映像を期間限定で公開中。",
      "エンゲージメント: 中",
      "「THE IDOLM@STER 765PRO ALLSTARS LIVE ～NEVER END IDOL!!!!!!!!!!!!!～」Blu-rayを受注受付中。",
      "ライブは2025年8月2日、3日にKアリーナ横浜で開催された。",
      "765PRO ALLSTARS＋全員集合による、アイドルマスターシリーズ20年間の歴史の節目を飾る集大成公演。",
      "特装版には両日の本編映像、フォトブック、豪華BOXが付属。",
      "収録内容はディスク4枚組で、Disc1がDAY1本編、Disc2がDAY1アンコール＋メイキング、Disc3がDAY2本編、Disc4がDAY2アンコール＋メイキング。",
      "アソビストア購入店舗特典はA4クリアファイルで、素材はPP、サイズは約W220×H310mm。",
      "765PRO ALLSTARS＋全員集合の集大成公演。",
      "特装版には両日の本編映像、フォトブック、大ボリュームの豪華BOX仕様が付属。",
      "アソビストア購入店舗特典はA4クリアファイル。",
      "A4クリアファイルの素材はPP。",
      "A4クリアファイルのサイズは約W220×H310mm。",
      "A4クリアファイルの生産国は日本。",
      "収録予定内容はBOX＆フォトブック付属。",
      "収録予定内容はディスク4枚組。",
      "Disc1はDAY1本編。",
      "Disc2はDAY1アンコール＋メイキング。",
      "Disc3はDAY2本編。",
      "Disc4はDAY2アンコール＋メイキング。",
      "ダイジェスト映像が期間限定で公開中。"
    ],
    "origin": "explore",
    "via": "explore",
    "verify": "confirmed",
    "deadline": "2026-09-27",
    "published_date": "2026-09-26"
  },
  {
    "id": "202609280733-explore-1",
    "title": "ノクチル単独ライブ開催決定",
    "brand": "shiny",
    "source_type": "公式",
    "url": "https://idolmaster-official.jp/live_event/283_noctchill/",
    "found_at": "2026-09-28T07:33:03+09:00",
    "dedup_key": "shiny-noctchill-live-2027",
    "facts": [
      "公演名は「283 Production LIVE Performance noctchill」。",
      "2027年3月27日(土)に第一公演「ただ眩しかった」を開場12:00・開演13:00で開催する。",
      "2027年3月27日(土)に第二公演「きみと一緒だったら」を開場16:00・開演17:00で開催する。",
      "2027年3月28日(日)に第三公演「きっと忘れない」を開場12:00・開演13:00で開催する。",
      "2027年3月28日(日)に第四公演「さよなら」を開場16:00・開演17:00で開催する。",
      "会場はゼビオアリーナ仙台。",
      "出演アイドルは浅倉透、樋口円香、福丸小糸、市川雛菜。",
      "アソビストアプレミアム会員先行の受付期間は2026年9月27日（日）19：00～10月12日（月・祝）23：59。",
      "アソビストアプレミアム会員先行の当落発表は2026年10月24日（土）13：00～。",
      "アソビストアプレミアム会員先行の入金期間は2026年10月24日（土）13：00～10月28日（水）23：59。",
      "枚数制限はお一人様1公演につき2枚まで（複数公演申込可）。",
      "ティーン割チケットは公演当日時点で20歳未満が対象で、全席指定4,120円(税込)。",
      "エンゲージメント: 高",
      "言及アイドル: 浅倉透、樋口円香、福丸小糸、市川雛菜",
      "公演名は283 Production LIVE Performance noctchill",
      "会場はゼビオアリーナ仙台",
      "第一公演「ただ眩しかった」は2027年3月27日、開場12:00・開演13:00",
      "第二公演「きみと一緒だったら」は2027年3月27日、開場16:00・開演17:00",
      "第三公演「きっと忘れない」は2027年3月28日、開場12:00・開演13:00",
      "第四公演「さよなら」は2027年3月28日、開場16:00・開演17:00",
      "出演アイドルは浅倉透、樋口円香、福丸小糸、市川雛菜",
      "現地+xRライブストリーミングのメモリアル特典付き4公演通し券は税込80,000円",
      "現地チケット全席指定4公演通し券は税込39,200円",
      "メモリアル特典付き現地+xRライブストリーミングセットチケットは税込20,000円",
      "現地チケット全席指定は税込9,800円、ティーン割チケット全席指定は税込4,120円",
      "メモリアル特典はレプリカ卒業証書、オリジナル卒業証書入れ、直筆メッセージ入り卒業式プログラム、チケット風ステッカー",
      "アソビストアプレミアム会員先行: 2026年9月27日（日）19:00～10月12日（月・祝）23:59",
      "当落発表: 2026年10月24日（土）13:00～",
      "入金期間: 2026年10月24日（土）13:00～10月28日（水）23:59",
      "枚数制限: お一人様1公演につき2枚まで（複数公演申込可）"
    ],
    "origin": "explore",
    "via": "explore",
    "verify": "confirmed",
    "event_date": "2027-03-27",
    "deadline": "2026-10-12",
    "published_date": "2026-09-27"
  },
  {
    "id": "202609280733-explore-2",
    "title": "Master ShowPiece打ち上げガシャDAY2",
    "brand": "shiny",
    "source_type": "公式",
    "url": "https://idolmaster-official.jp/news/01_19898.html",
    "found_at": "2026-09-28T07:33:03+09:00",
    "dedup_key": "shiny-msp-afterparty-gasha-day2-2026",
    "facts": [
      "「有償限定 283 PRODUCTION Solo Live Collection -Master ShowPiece- 打ち上げガシャDAY2」が開催中。",
      "STEP4で特別S-SSR「Master ShowPiece」西城樹里を獲得できる。",
      "STEP6に「Master ShowPiece」西城樹里のアイドルピース×10が付く。",
      "STEP1～4はトワコレと期間限定アイドル入りでSSR2倍。",
      "STEP5～6はパラコレと期間限定アイドル入り。",
      "STEP5は無料でSSR以上が確定。",
      "STEP1～4、6の最後の1枚はSSR以上確定。",
      "開催期間: 開催中～2026年10月2日(金) 23:59まで(予定)。",
      "エンゲージメント: 高",
      "言及アイドル: 西城樹里",
      "「キャスティングコレクション～甘えん坊な妹編～」を開催予定。",
      "白瀬咲耶、樋口円香が登場する。",
      "特訓2回で、アイドルがキャスティングされた実際のドラマ・舞台等の台本を獲得できる。",
      "特訓4回で、台本を元にアイドルが実際に演じるボイスを解放できる。",
      "開催期間: 2026年9月29日(水) 15:00～2026年10月20日(火) 11:59まで(予定)。",
      "エンゲージメント: 中",
      "言及アイドル: 白瀬咲耶、樋口円香",
      "「有償限定 SSR最大20％『Heavy,Heavy Rain』小宮果穂 特別アイドルステップアップガシャ」を開催予定。",
      "AXE8シリーズ限定のS-SSR「Heavy,Heavy Rain」小宮果穂が新登場。",
      "STEP3はSSR15％で最後の1枚はSSR以上確定。",
      "STEP4はSSR15％で最後の1枚は限定SSR確定。",
      "STEP5はSSR20％で最後の1枚は「Heavy,Heavy Rain」小宮果穂確定。",
      "開催期間: 2026年9月29日(火)～2026年10月2日(金) 23:59まで(予定)。",
      "言及アイドル: 小宮果穂",
      "「283 PRODUCTION Solo Live Collection -Master ShowPiece-」の打ち上げPアイドルガシャを開催中。",
      "ストリート・アンド・アヴァンガードのアイドルが登場する。",
      "アーバン・アンド・ライフスタイルのアイドルが登場する。",
      "開催期間: 開催中～2026年10月4日(日) 23:59まで(予定)。",
      "限定★3「霧雨、湿る街の淑女」月岡恋鐘が登場する。",
      "限定★3「夜更け、鳴り響くのは汽笛」田中摩美々が登場する。",
      "限定★3「轟音、煌めきのカフェテラス」三峰結華が登場する。",
      "限定★3「レメクス、しなやかに風捉え」七草にちかが登場する。",
      "開催期間: 開催中～2026年10月21日(水) 11:59まで(予定)。",
      "言及アイドル: 月岡恋鐘、田中摩美々、三峰結華、七草にちか",
      "2027年6月5日(土)・6日(日)の2日間、神奈川県・横浜アリーナにて「THE IDOLM@STER SideM × SHINY COLORS SPARKLE SHOWDOWN」を開催予定。",
      "315プロダクションと283プロダクションによる対バンライブ。",
      "現在、アソビストアプレミアム会員先行を実施中。",
      "受付券種は「SPプロデューサーシート」と「プロデューサーシート／全席指定」。",
      "SPプロデューサーシートの受付URLは https://asobiticket2.asobistore.jp/receptions/8da7197d-17b3-41e7-9ecc-409a23aa7881。",
      "プロデューサーシート／全席指定の受付URLは https://asobiticket2.asobistore.jp/receptions/fb895834-4d04-46e2-9bae-322c3e4281c8。",
      "アイドルたちの“熱いバトル”を楽しめるライブとして案内されている。",
      "2027年3月27日(土)・28日(日)にゼビオアリーナ仙台で「283 Production LIVE Performance noctchill」を開催する。",
      "2027年3月27日(土)は12:00開場／13:00開演、16:00開場／17:00開演の2公演。",
      "2027年3月28日(日)は12:00開場／13:00開演、16:00開場／17:00開演の2公演。",
      "出演者は浅倉透、樋口円香、福丸小糸、市川雛菜。",
      "アソビストアプレミアム会員先行の受付期間は2026年9月27日(日)19:00～10月12日(月・祝)23:59。",
      "当落発表は2026年10月24日(土)13:00～。",
      "入金期間は2026年10月24日(土)13:00～10月28日(水)23:59。",
      "枚数制限は1公演につき2枚まで。",
      "小学生～20歳未満を対象にしたティーン割チケットを用意する。",
      "言及アイドル: 浅倉透、樋口円香、福丸小糸、市川雛菜",
      "「THE IDOLM@STER SHINY COLORS ORCHESTRA CONCERT -Radiant Chord-」の開催が決定した。",
      "シャニマス初の単独オーケストラコンサート。",
      "アソビストアプレミアム会員最速先行は抽選で受付中。",
      "受付期間は2026年9月26日(土)20:00～10月18日(日)23:59。",
      "オーケストラの生演奏でシャニマスの楽曲を届ける。",
      "「THE IDOLM@STER SideM × SHINY COLORS SPARKLE SHOWDOWN」を2027年6月5日(土)・6日(日)の2日間開催予定。",
      "会場は神奈川県・横浜アリーナ。",
      "アソビストアプレミアム会員先行を実施中。",
      "SPプロデューサーシートとプロデューサーシート／全席指定の券種がある。",
      "2027年3月27日(土)は「ただ眩しかった」12:00開場／13:00開演、「きみと一緒だったら」16:00開場／17:00開演。",
      "2027年3月28日(日)は「きっと忘れない」12:00開場／13:00開演、「さよなら」16:00開場／17:00開演。",
      "出演者は浅倉 透、樋口 円香、福丸 小糸、市川 雛菜。",
      "アソビストアプレミアム会員先行の券種は、【メモリアル特典付き】現地+xRライブストリーミングセットチケット4公演通し券、現地チケット（全席指定）4公演通し券、【メモリアル特典付き】現地+xRライブストリーミングセットチケット、現地チケット（全席指定）。",
      "受付期間: 2026年9月27日（日）19：00～10月12日（月・祝）23：59",
      "当落発表: 2026年10月24日（土）13：00～",
      "入金期間: 2026年10月24日（土）13：00～10月28日（水）23：59",
      "枚数制限は、お一人様1公演につき2枚まで（複数公演申込可）。",
      "本チケットはアソビストアプレミアム12か月会員のみ申し込み可能で、アソビストアプレミアム1か月会員は対象外。申し込みから当落発表までに12か月会員を退会すると抽選対象外。",
      "言及アイドル: 浅倉 透、樋口 円香、福丸 小糸、市川 雛菜",
      "本公演では小学生～20歳未満を対象にしたティーン割チケットを用意する。",
      "公演当日（2027年3月27日・28日）時点で20歳未満で、受付時に年齢確認可能な身分証を持参できる人が対象。",
      "年齢を確認できない場合、入場時に現地チケット（全席指定）との差額を支払う場合がある。",
      "ティーン割チケットはスタンド後方に配置予定。",
      "アソビストアプレミアム会員先行の対象者と共に抽選し、申し込みによって当選確率が変動するものではない。",
      "28名のアイドルの新ソロ曲をイメージしたデザインのグッズが登場。",
      "キービジュアルをあしらったグッズも受注中。",
      "受注期間: 2026年10月12日(月･祝)まで",
      "ソロライブの配信チケットを販売中。",
      "10月3日(土)・4日(日)にキャスト生出演オーディオコメンタリー付き同時視聴上映会を開催予定。",
      "販売期間: 2026年8月25日(火)19:00～10月5日(月)18:00（予定）",
      "アーカイブ視聴期間: 2026年9月28日(月)18:00～10月5日(月)23:59（予定）",
      "「THE IDOLM@STER SHINY COLORS ORCHESTRA CONCERT -Radiant Chord-」の開催が決定。",
      "アソビストアプレミアム会員最速先行（抽選）を受付中。",
      "受付期間: 2026年9月26日(土) 20:00～10月18日(日) 23:59",
      "本先行はアソビストアプレミアム12か月会員のみ申し込み可能で、1か月会員は対象外。",
      "応募多数の場合は抽選によりすべての申し込みが落選する可能性がある。",
      "「有償限定 283 PRODUCTION Solo Live Collection -Master ShowPiece- 打ち上げガシャDAY2」を開催中。",
      "STEP4で本ライブの特別S-SSR【Master ShowPiece】西城 樹里を獲得できる。",
      "STEP6に【Master ShowPiece】西城 樹里のアイドルピース×10が付く。",
      "STEP5は無料でSSR以上が確定し、STEP1～4・6の最後の1枚はSSR以上確定。",
      "【開催期間】開催中～2026年10月2日(金) 23:59まで（予定）",
      "言及アイドル: 西城 樹里",
      "「キャスティングコレクション～甘えん坊な妹編～」に白瀬 咲耶、樋口 円香が登場する。",
      "開催期間: 2026年9月29日(水) 15:00～2026年10月20日(火) 11:59まで（予定）",
      "SSRプロデュースアイドルは【これも可能性】白瀬 咲耶、【Hug？】樋口 円香。",
      "言及アイドル: 白瀬 咲耶、樋口 円香",
      "「有償限定 SSR最大20％【Heavy,Heavy Rain】小宮 果穂 特別アイドルステップアップガシャ」を開催予定。",
      "AXE8シリーズ限定のS-SSR【Heavy,Heavy Rain】小宮 果穂が新登場。",
      "STEP3はSSR15％で最後の1枚がSSR以上確定。",
      "STEP4はSSR15％で最後の1枚が限定SSR確定。",
      "STEP5はSSR20％で最後の1枚が【Heavy,Heavy Rain】小宮 果穂確定。",
      "【開催期間】2026年9月29日(火)～2026年10月2日(金) 23:59まで（予定）",
      "言及アイドル: 小宮 果穂",
      "「283 Production LIVE Performance noctchill」の開催が決定。",
      "会場はゼビオアリーナ仙台。",